{
  "schema_version": "argus.conversation_event/v1",
  "event_id": "evt_01",
  "sequence": 1,
  "enterprise_id": "ent_01",
  "conversation_id": "chat_01",
  "run_id": "run_01",
  "event_type": "tool_call_result",
  "actor_type": "worker",
  "actor_id": "worker_01",
  "occurred_at": "2026-08-15T02:45:00Z",
  "content_hash": "0123456789abcdef0123456789abcdef",
  "artifact_ref": "artifact_01",
  "data_classification": "internal",
  "payload": {"tool_call_id": "call_01", "result_ref": "result_01"}
}
